{
  "version": 1,
  "name": "Mostly elsewhere",
  "description": "Members and repos this node has never seen",
  "members": [
    "did:key:z6MkpQTLwr8QyADGmBGAMsGttvWzP4PojUMs4hREZW5T5E3K",
    "did:key:z6MknG1nYDftMYUQ7eTBSGgqB2PL1xK5Pif33J3sRym3e8ye"
  ],
  "repos": [
    "rad:z42hL2jL4XNk6K8oHQaSWfMgCL7ji",
    "rad:zyFFr2iwoTEfNF4jGNZHuoy7odMh"
  ]
}
